Review_ID,Truly_Predicted_Class,Original_Text,Explanation,Label
23,Positive,place must thursday night bring date rincon wife son daughter two table electric traditional dancing atmosphere now waiter huge help group tapas selected octopus sardines ham cheese stuffed olives julio upset two best sellers garlic sauce churrasco quail egg brought red sangria dinner sherry plenty table reservation next time ,must thursday night bring date ,0
120,Negative,review much say put top seemed bit side will others less cheesesteak much rather part seem much flavor overall eating already made going try cheesesteak ,review much top seemed others ,0
14,Positive,second last time went years staff attentive times uno offered table even making reservations thursday live flamenco nights remember time good ordered bunch small plates ranging shrimp goat pretty taste go back food mentioned ,went staff attentive times reservations ,0
110,Negative,always see tv really wanted eat philly cheesesteak got compare far tourist liberty hall one apparently mentioned live reputation gave one hard bag rejected told go one fries line patience know order right preferred husband cheesesteak one bread old meat little real good though got sandwich texture although pretty skimpy husband got melted go street blocks liberty bell also cheaper go recommend ,see wanted eat philly cheesesteak ,0
22,Positive,friends birthday dinner around say wandered aimlessly minute well service amazing unueo prounounced card top funny jokes impeccable attentive extra attention birthday big sangria cake guy nothing short awesome sir food mon options choose flavor sangria well mango flavored one mango perfect sweet strong girls two enough tapas two tapas size regular sizes lot somehow managed version sauce sauce amazing take sauce mussels ate thing bread soaked garlic sauce loved friend believe garlic sauce oxtail juicy def point enjoy oxtail nice cozy spot music fridays best avoid planning talk lot ,friends birthday dinner say well ,1
127,Negative,friend traditional bit noon bad spot block much line got already forming decor pretty say got food seconds pretty racist signs place putting really reconsider reading signs really go back english press deporation really patriotism cross incredibly far ordered cheese fries coke american cheese onions ordering bit confusing different cheesesteak one move window fries pay prettttty slices onions ish really well roll looked wet one actually grease napkins went napkins felt digestible however tasty cheesefries fries bad whiz top bottom fries stuck together back another friend visiting wanted right across street really go overpriced signs really putting ,friend bad block much got ,0
57,Positive,pats genos better personally used great read cheaped customer service surprisingly genos tourist sightseeing know go great steaks even seek second creepin nearly allow one ,pats great customer surprisingly one ,0
76,Negative,tourist trap says tony inflammatory vomit darling merica think cheesesteak someone surname wreaks steerage countries digress things getting cheesesteak corner bodega soulless wage job self satisfied tony ventos authentic scarfing steak made steakums mom bought sale getting cheese bucks short break guy merica idiots think paying line places never wanted put steak authentic grew subhumans serve rude line ,tourist trap says tony think ,0
168,Positive,think better meat tender tastes better say whiz melty starting taco bell melt sandwiches fast cheese goes bun little ask melt next time ground next one killed line duty though people actually nice think funny though classic classics gotta ,tender say starting melt fast ,0
80,Negative,food ordered popular cheese whiz beef tougher street rival tough cheese service order cheesesteak first drinks second know food time find location corner better much come tell definitely trap ,food ordered popular cheese whiz ,0
15,Positive,time trying definitely last waiter helpful offered nice food got churrasco caracoles pelotillas de queso de cabra fried cheese delicious got try favorite skirt steak sauce tasty drinks good come big glass sangria good enough expensive good food come ,definitely helpful churrasco de delicious ,1
102,Negative,philly fair share philly years personally true native philadelphians big pats tourist area steaks tasting mention pieces big add meat since food channels think rude comments speak taken shake tourist countries steaks across place racist way show honor country needless say typically prefer philly steaks philly will trap overall food good ,philly share years tourist steaks ,0
35,Positive,birthday ppl professional super easygoing friendly guy special day special came night made reservation confirmed nice call tapas great potato flavored highly recommend garlic tapas dish much white asapagus dish quite bland baby quite nice entertaining watch birthday girl yes surprise forget mango delicious sangria townnn heck two pitchers every savory good gave buzz ,birthday professional super friendly special ,1
103,Negative,philly philly crack well guess expecting miracles tried experience satisfying sandwich one window fries another wait extremely short detract long may familiar sandwich whopping seems bit minute consume half extreme doubtful great meat perceptible cheese bread tasted thawed true worth money ,philly guess experience sandwich window ,0
44,Positive,favorite restaurant place life tempted try lover flamenco finally day arrived around asking two little lovely make wait entire hour fact basically losing since gone else instead sitting waiting idea appreciate rush anyway ogling food little table empty finally first gambas ajillo tell number wanted go badly today craving surpassed expectations end eventually servings croquetas bacalao queso de cabra ham still thing fantastic also amazing tinto tasty mango sangrã died still exquisite top dessert also perfect tarta de santiago beautifully balanced absolute best pals tonight forward coming back much frequently ambiance music knew played please forget flamenco show wonderful everyone ,favorite restaurant life try lover ,1
74,Negative,place full ethnically political immigrants even bring cheesesteak tasted steaks goodl back place years ago wanted street point never tried friends steaks first place walk waited line friends extremely prejudiced signs philadelphia establishment face working seemed rude across picked upside offensive signs steaks great south st prince classic want good cheesesteak much delicious supporting ,place even cheesesteak tasted steaks ,0
49,Positive,fact day means drink early village let yelpers guide decision led nai choice let waiter owner choose urgently octopus house fried crostinis sauce thrilling plate awesome crostinis delicious sangria make vat every day full choice red white pitcher first said pitcher white hehe yummy want go red bloody ,day early village yelpers nai ,0
63,Negative,long wait philly cheesesteak maybe expectation honest worth wait hype thing got excited took food say even extremely nothing bad talking really enjoy philly cheesesteak good ,long wait philly cheesesteak maybe ,0
28,Positive,minute friday night dinner reservation see nai still went service food service absolutely several times never friendly great recommendations checked regularly encouraged us try flavor yes pleasee even offered replace liking food meatballs bomb croquettes flavorful definitely recommend steak patatas bravas bit potato big alioli instead stood ed particular experience seating ambiance warm friendly anyone larger group dinners ,night dinner reservation nai still ,0
124,Negative,might fair tried steaks extremely satisfied set tough say much piping hot flavor cheese practically onions neither lemonade wash dryness steak thing things things bigotry extremely country proud felt terrible saying order english employees need ridiculous signs cheesesteak dry meat little cheese onions ruined think back ,steaks extremely tough much cheese ,1
53,Positive,quick check place hipsters stopped evening check live flamenco music music wonderful atmosphere even better good food interesting people also professional liked bartender tonight around ten things orders pouring moment food order still piping hot small experiences helpless food cooled end bar really appreciated happen flamenco dancers every definitely back ,quick stopped evening flamenco music ,1
60,Negative,town wanted philly took personally heard many good expect decent cheesesteak ordered cheesesteak cheesesteak less minutes sure babies now well many said cheesesteak bread chewy yank actual bite toasted stale mediocre meat barely tasted bit hard going first give food service save trouble list ,town wanted philly took heard ,1
13,Positive,months old friend cute place going gambas ajillo pretty much garlic gonna meal remember tail hour ended pretty never really sangria neighborhood recommend folks looking area small group ,months old cute gambas pretty ,1
165,Negative,warning stay away many bugs bug zapper end lived philly touristy pats tony many almost across pats places ever steaks par flavorless excited now street stay warned ,warning away many end philly ,1
12,Positive,came absolutely chose wanted make everyone something liking waiter nice recommendations preferences also making reservation put small next window moved spacious next dinner good gave us bread good go bacalao grilled shrimp try skeptical stew best try also sangria price time waiting good couples groups highly place ,absolutely make everyone also reservation ,0
163,Negative,worst steak understand likes unfriendly rude normal food steak pepper plastic way priced soggy bland let wife new philly tourist treat sorely steak unknown joint broad street good guy rude steak place ,worst steak understand rude food ,1
47,Positive,say enough nai group came day went beyond serve high top table tables back taken server laid back many tapas order everything away tapas pitchers white sangria standouts croquettes bravas fish dishes good well however stood accidentally brought touched house brought us house well whole ended tip alcohol kind service new alone incredibly upscale good prices unpretentious outstanding ,say enough nai group day ,0
152,Negative,julia finally place passed knew great versus cheesesteak battle stop choose line neon lights hoping use gauge better even waiting asked one tourist sure town went whiz topping great philly looked thing wtf big pieces taste even home much better one will drop ,finally place passed knew cheesesteak ,0
471,Positive,strange swinging balance toes sway eating brunch used thought food pretty good kinda hit miss said one star terrible syrup pancakes water alongside also serve us meals must running drinks decided champagne lime juice friend mimosa tang lining glass sweet flavors drink although sip strong courses salmon poached eggs side crisp bacon hash even smoked salmon chopped roasted sauteed onions also done well hard loved bit bummed another syrup overall solid meal continental hiccups food makes ,eating brunch pretty good kinda ,1
2482,Negative,best way goldroc geographically location minute hartford enough many come full extensive blame people turned veggie wraps eggs tuna melt reubens even go foods pass mark leave spend eat gross expect gals tough good often service generally bone shrewd count see delivering asking admit bizarre brow deny free scantily crazy awkward people past mandatory based solely food falls terribly hard comes quite amount cheap entertainment ,way location many people turned ,0
